{
  "control_state": "candidate_not_enforced",
  "default_action": "deny",
  "execution_profile": "stage1_manual_pilot",
  "limitations": [
    "This file states the required enforcement posture; it is not an observation receipt.",
    "Activation requires a separate trusted runner receipt that binds the effective environment."
  ],
  "policy_ref": "https://github.com/Prometheus-Frameworks/TIBER-Ops/issues/54",
  "schema_version": "research-egress-enforcement-policy/v1"
}
